[
  {
    "edition": "10th",
    "dataslate": "2025-q2",
    "effective_date": "2025-04-14",
    "label": "Spring 2025 Balance Dataslate",
    "supersedes": "2025-q1"
  },
  {
    "edition": "10th",
    "dataslate": "2025-q3",
    "effective_date": "2025-07-07",
    "label": "Summer 2025 Balance Dataslate",
    "supersedes": "2025-q2"
  }
]
